{
  "$schema": "https://json-schema.org/draft/2020-12/schema",
  "title": "DongleReview",
  "description": "Schema for off-chain review comments referenced by CIDs in the Dongle contract",
  "type": "object",
  "properties": {
    "version": {
      "type": "string",
      "description": "The schema version of this review document",
      "default": "1.0.0"
    },
    "text": {
      "type": "string",
      "description": "The written content/comment of the review",
      "minLength": 1,
      "maxLength": 10000
    },
    "title": {
      "type": "string",
      "description": "Optional short summary or title of the review",
      "maxLength": 100
    },
    "language": {
      "type": "string",
      "description": "The ISO 639 language code or BCP 47 language tag of the review text",
      "pattern": "^[a-z]{2,3}(-[A-Za-z0-9]{2,8})*$",
      "examples": ["en", "fr", "pt-BR", "zh-Hant"]
    },
    "attachments": {
      "type": "array",
      "description": "Optional media attachments, screenshots, or proofs supporting the review",
      "items": {
        "type": "object",
        "properties": {
          "cid": {
            "type": "string",
            "description": "IPFS content identifier of the attachment file",
            "pattern": "^(Qm[1-9A-HJ-NP-Za-km-z]{44}|b[A-Za-z2-7]{58})$"
          },
          "mime_type": {
            "type": "string",
            "description": "MIME media type of the attachment",
            "pattern": "^[a-z-]+/[a-z0-9.+-]+$"
          },
          "name": {
            "type": "string",
            "description": "Human-readable name or description of the attachment",
            "maxLength": 255
          }
        },
        "required": ["cid", "mime_type"]
      }
    },
    "device_info": {
      "type": "object",
      "description": "Optional metadata about the device/client environment used to submit the review",
      "properties": {
        "client_name": { "type": "string" },
        "client_version": { "type": "string" },
        "platform": { "type": "string" }
      }
    }
  },
  "required": ["version", "text"]
}
